"Scribd | Android + iOS | Full time | ONSITE (REMOTE possible for more senior candidates in certain US states) | San Francisco, TorontoScribd offers all you can read ebooks and audiobooks for $8.99 a month and our apps get a ton of usage. We strive to build a great product, whilst considering ourselves primarily a technology company. We love to address technical debt, do things right the first time, encourage refactoring & trust engineers to know what is important.The job right now involves primarily Kotlin and Swift interfacing with a Ruby on Rails backend.Our interview process involves only directly relevant programming tasks, on your own hardware (if thats possible), with no whiteboard coding.We’ve hired a bunch of people from these “Who is Hiring?” HN threads, including myself!Please apply directly via the links below and I’ll know it is from here.Android: https://jobs.lever.co/scribd/4fa6b064-48fe-46fa-aab4-6fba243...iOS: https://jobs.lever.co/scribd/6d283383-27ed-49f9-992c-11c287e...If you have questions you can reach me at joe at scribd.com (I’m the head of mobile engineering and happy to answer any question related to this role).@recruiters & agencies - please do not contact me"
"LitCharts | React Native + Full Stack Developer | Full-time | Remote Only (USA) | https://www.litcharts.comCome help improve literature education with LitCharts! LitCharts provides high quality literature guides, analysis, and related literary tools and resources. Over two million students, teachers, and general interest readers use the LitCharts website and mobile apps every month.We are looking for a full-time React Native developer with full stack web development experience to work on all aspects of the mobile app and website. Must be proficient with React Native, Ruby and Ruby on Rails, and working remotely.We’re a small team, and the code you write will have a direct impact on our success as well as reach millions of users. You can work from home or anywhere. We work flexible hours but typically stick to 9am-5pm EST and are looking for someone able to do the same. All applicants must also be legally authorized to work in the United States.Please email your resume, Github profile, samples of your code/work, or anything else you'd like to us to know about to hiring@litcharts.com to apply. Thanks for reading!"
"Grio | Senior Web and Mobile QA Tester | Senior Software Engineer, Web | iOS Engineer | Android Engineer | Senior Android Developer | San Francisco, CA | Mexico City, MX | ONSITE | REMOTE possible | https://grio.comGrio is a web and mobile app studio with offices in San Francisco and Mexico City. We've been around for over 10 years and we're all about quality software, doing the right thing for our clients, and maintaining a collaborative, fun community. We work on both web and mobile software projects. At Grio, we empower every employee to grow their skills and make an impact on our business.Amazing Colleagues - We hire passionate, talented, and respectful people. You’ll work with colleagues who bring genuine enthusiasm to their jobs, embrace opportunities to improve, and know how to make work fun.Great Opportunities - We embrace cutting-edge technology and innovation. Because we work on a wide variety of projects for many different types of companies, you can expect to learn new things all the time.Investment in Your Success - We want you to feel invested in your work, your career path, and the future of Grio. You’ll have direct input on the projects you work on, and open access to a leadership team that welcomes suggestions and feedback.
Recognition and Support: We genuinely value everyone on our team. We provide competitive benefits and compensation, great work-life balance, and a fun, relaxed work environment in our downtown San Francisco and Mexico City offices.Email `cchiesa@grio.com` and mention this post."
"F9 Teams | Software Engineer | Java | Boston | Onsite  (or remote with up to 80% travel for the first 3 months) | https://f9teams.com/F9 Teams has partnered with Kessel Run, a flagship software development organization, that’s been tasked with rapidly modernizing the way we build, deploy, scale, and run software in support of operations around the globe.- Focus on scale, automation, and high-availability platforms for members around the globe- Introduce modern cloud best-practices to the redesign of complex, mission-critical platformsTo apply:allyssa at f9teams dot comor:https://f9teams.com/#jobs"
"Foxpass (YCS15) | San Francisco, CA | FULL-TIME | ONSITE or REMOTE | Senior Software Engineer (Backend) & Head of MarketingFoxpass, a YCombinator (S15) company, is looking for early employees who wish to create software to help companies implement good security practices in their infrastructure. Doing security ""the right way"" should be easy. Our first product offers SSH key management, LDAP, and RADIUS in the cloud to ensure that engineers and employees use their own accounts to log into servers and wireless networks. Furthermore, we're encouraging companies to make access control API-based, so that access can be given and then rescinded as soon as possible (on-call shift over, JIRA ticket closed, etc.).We are looking for:1) A senior back-end engineer who has significant experience with building and operating high-uptime, high-performance systems in the cloud. https://angel.co/foxpass/jobs/79642-senior-software-engineer2) A Head of Marketing to kick off our marketing function to spread the word and help us find more happy Foxpass customers. https://angel.co/foxpass/jobs/468017-head-of-marketingemail me: aren@foxpass.com. No agencies, please."
"TileDB, Inc.  |  Full-Time | Cambridge, MA or REMOTE (US)  | https://tiledb.ioTileDB is a disruptive technology for storing and managing enormous volumes of structured data, adopting the best ideas from columnar and spatial database research to support fast updates, compression, and interoperability with scalable cloud object storage backends. TileDB efficiently stores data generated from variety of domains (genomics, finance, imaging, geospatial, etc) in a novel unified format as sparse or dense multidimensional arrays.  Users can store their data in a unified namespace, while being able to efficiently access this data via a growing number of language APIs and interfaces (C/C++, Python, R and SQL data engines).TileDB, Inc. has raised $4M in seed funding over the past 18 months. We are looking to aggressively expand our team. The new members of TileDB will help us build out a solution to enhance cloud interoperability, bring scalable computations to data stored in TileDB more easily, and improve areas such as data consistency, access control and sharing on the cloud through a managed service.We currently have open positions in the following areas:- Backend / frontend / full-stack engineers (Vue.js / Go / K8s)- Experts in databases / database engines (C++ / Java / Scala)- Scientific programmers (Python, R)TileDB GitHub organization: https://github.com/TileDB-IncTileDB has been featured on HN: https://news.ycombinator.com/item?id=15547749.Our headquarters are located in Cambridge, MA. The candidates must be US citizens or permanent residents located in the US.Apply today at https://tiledb.workable.com !"
"Bagel Health (YC W19)
First employee (Full-stack engineer)
Decent cash salary plus first-employee equity (standard vesting)
REMOTEWork at a YC startup trying to fix healthcare! Or at least improve a small part of it.Bagel is a new electronic health record for the growing number of doctors that don't accept insurance, particularly direct primary care (DPC) docs. DPC is trying to cut insurance out of primary care. It makes no sense to use insurance to pay for basic or routine medical services; do you use your car insurance to pay for an oil change? There are some seriously great knock-on benefits of getting rid of insurance too. Here's a good rundown: https://srconstantin.wordpress.com/2018/09/25/direct-primary...We're still in the early design phase, and we'll be starting implementation soon. We'll hit the ground running; I'd like to get a usable version out within three months.Here's the tentative stack: Typescript, React, Apollo Client, backend on Google Cloud (App Engine, probably), GraphQL, Postgres (+ Sequelize or similar). Ideally you'd be awesome at a few of these and competent in the rest.I'm Colin McDonnell, MIT EECS 2016, the sole founder of Bagel, and all-around nice person. If you're interested in working together, email me at colin(at)bagel(dot)md with a resume and a bit about you and why you're interested! Cheers."
