"SAF Platform | Full Stack Engineers | REMOTE | FT | www.safplatform.comSAF Platform builds software that digitizes the workflow of alternative investments for institutional investors and asset managers. Our mission is to give our clients control over the investment process through the use of our platform. We are a growing company with leadership that has a track record of success. Our company is based out of NYC, but our engineering team is 100% remote. We currently have engineers based in North America, South America and Europe.Full Stack Engineer - http://bit.ly/fseatsafplatformWe are currently looking for mid-to-senior engineers, based out of the Americas, to join our team. This is a great opportunity to make a significant impact on a growing team. See above job description for more information.Stack:* Ruby, Rails, JS, React* Docker, Git, and CircleCI* AWS"
"Canvas Medical | Full Stack and Front End Engineers | San Francisco | REMOTE | Full Time | https://canvasmedical.com/We're looking for front-end and full-stack developers. Our typical toolset includes React, Typescript, Redux, Webpack, Django, Python, Postgres, Docker, Linux, and AWS.We value passion, pragmatism, discipline and testing until you’re confident. We believe communication and empathy are core competencies for people who build technology.Canvas was founded in 2015 to rebuild the technology infrastructure for primary care providers. This includes core medical record technology as well as patient-facing products. We're backed by top venture firms and are headquartered in San Francisco.Email me on careers@canvasmedical.com"
"Station A // early-stage clean energy start-up // SF Bay Area (remote considered) // Senior Software Engineer (full-time) // https://stationa.comStation A is hiring its first senior software engineer!Station A’s mission is to enable a carbon-neutral future by scaling and automating the clean energy development process. Our software platform connects clean energy developers with building owners and enables them to plan and execute projects that ultimately take any building to zero carbon emissions.We are currently a team of four co-founders, based in San Francisco, CA, and recently closed a round of venture funding that we plan to use to scale quickly. We are looking for ambitious and driven individuals to help build a company that transitions the world to 100% clean energy.If you're interested in learning more, check out the full job description at https://stationa.com/careers/2019/senior-software-engineer or reach out to us at careers[at]stationa.com"
"Commure, Inc. | San Francisco, CA / Boston, MA | Rust Engineer | Fulltime | ONSITEWe are a stealth startup working to fix the software doctors use. If you have seen what physicians have to put up with, it's a bad version of the 90s, and makes medical care worse and more expensive for everyone. We are a group of previously successful engineers and entrepreneurs (MIT, Dartmouth, Stripe, Twitter, Salesforce, DataPower, etc) and senior doctors (Johns Hopkins, UCSF, etc) who are determined to finally fix this.Compensation: market salary & equity -- we are well funded by top-tier VCs.Stack: includes Rust, React and Kubernetes. In addition to building our back end in Rust, we are also solving some very interesting problems in the areas of data transformation, high-speed APIs, flexible UX frameworks and fine-grained authorization for healthcare data.Please email jobs@commure.com and mention ""[hnrust]"" in the subject line.Other positions available: 
- Senior Front End Engineer (React Native, React) 
- Senior Security Engineer (OAuth, SAML, identity, etc) (please use [hnfe] or [hnse] in subject line for the above).Locations: San Francisco, Boston or Montreal; sorry, no distributed/remote option at the moment."
"Ebury | Python Backend Developers, SREs, SRE Team lead | Full Time | Remote (CET ±3 hour) | https://ebury.com | https://careers.ebury.comEbury is a FinTech headquartered in London & with offices across Europe, Dubai, North America, and APAC, we empower businesses that want to trade and transact internationally.
We drive innovation through technology, providing businesses with tools such as import lending, currency and risk products, and payment and collection facilities.
We have a Tech team of 60+ people across Europe. We hire remote-first for SRE, Salesforce and Ebury API team. 
Our tech stack consists of lots of Python (Django and Flask) on the backend, Vue.js SPAs on the frontend. We run fully in AWS, with a mix of ECS and EC2.Our current remote roles:* Ebury API Tech Lead (Python/Flask) - https://careers.ebury.com/open-positions/position/?id=73e3d6...* Senior Python Developer - https://careers.ebury.com/open-positions/position/?id=20ca49...* Devops and SRE Team lead - https://careers.ebury.com/open-positions/position/?id=ab5ac3...* Site Reliability Engineer (SRE) - https://careers.ebury.com/open-positions/position/?id=c281a1..."
"REMOTE long-term contract position with good pay for experienced React developer.Company Description: Facilitation Labs is an early stage corporate innovation consulting firm focused on helping the insurance industry take advantage of new technological capabilities. We have an immediate opening to work on one specific initiative building proprietary technology in partnership with a Fortune 500 insurance company that will have broad applications and a significant impact on the status quo of how insurance is bought and sold.What You’ll Do: This is a fully remote, long-term contract opening for senior developers (5+ years experience) React web developers (2+ years) with TypeScript proficiency. As part of a small team you’ll personally make a substantial contribution and your decisions will matter. 
Help define the architecture and tooling for complex backend systems and data pipelines
Own and develop complex and secure services in React.js (heavy experience with TypeScript also desired)
Set and hold a high bar for quality, well-tested code
Motivated by a fast-paced, rapidly changing environment where every action drives company's success and defines engineering culture at Facilitation Labs
On the job you’ll be using basic familiar tools like GitHub and Slack.Technologies We Use:
TypeScript, React.js, Redux, Go
Firebase, Hashicorp Vault, S3
AWS, Linux, Kubernetes, Docker
Github, SlackYou Have:
5+ years professional work experience as a Software Developer
2+ years working with React.js
Experience with TypeScript
Experience working remotely, including open-source projects
Fluent written and verbal English communicationTo Apply:
Send a resume to jobs@facilitationlabs.io along with an answer to the question:
 “why must you always use setState instead of modifying React state directly?” Please add links to any React work you’ve done that you’d like to share, include a link to the repo if open-source."
"CyberArk (Conjur team) | Front End / Backend / DevOps / Security | REMOTE (OR ONSITE NEWTON, MA) | FULL-TIME
The CyberArk Conjur team helps people write super reliable software that's hard to hack. We're building tools that make the best security practices convenient for developers, ops, and security teams. We're hiring engineering managers, product owners, and of course, engineers.ABOUT USWe're a busy team, thanks to the increasing success of our product: the Conjur appliance secures the entire software development and deployment lifecycle for companies who want to ship features as fast as possible without increasing their risk of security breaches.We are looking for experienced software engineers to join our team. Conjur engineers work on a wide variety of projects, from integrations with some of today's most popular DevOps tools to moonshot projects that seek to revolutionize the way engineering teams factor in security when deploying applications.We know that if you're a professional engineer, experience with specific tools or languages can usually be picked up quickly. That being said, Conjur engineers are using the following tools on a more-or-less daily basis:* Ruby, Rails, Golang, Postgres, and JS* Docker, Git, and Jenkins* Kubernetes, OpenShift, Cloud Foundry* Puppet, Chef, AnsibleFOR MORE INFORMATIONhttps://conjur.org (our secret service, AGPLv3) https://www.conjur.org/careers/engineering.html (about our team, and our DevOps puzzle!) https://conjur.org/blog (our blog, which talks more about who we are and what we do)"
"Aha! (http://www.aha.io) | Rails / Devops / Front End | REMOTEAha! is looking for experienced Ruby on Rails engineers to work on the Aha! product. We use Rails extensively, plus React for rich browser based experiences.Aha! is also looking for a Devops engineer, experienced with Ruby & AWS to help build and maintain our fully automated infrastructure. All of our operations is done by writing code first, so it is fully reproducible.Aha! is the #1 tool for product managers to plan strategy and roadmaps. Aha! is profitable, you can work from anywhere in North America and we offer excellent benefits. We use our own product to manage our work (which is especially rewarding), we deploy continuously and we are developing in Rails/ES6/React.Our entire team is remote - in US, Canada and Mexico so we can collaborate during the work day.http://www.aha.io | email: engineering-jobs@aha.io"
"HealthPrize | Frontend Engineer | REMOTE or NYC, Norwalk, CT | Full-time | https://healthprize.com
At HealthPrize, we are changing the way people think about their medication and their health! Our growth is being fueled by work with leading brands in life sciences such as Abbott, Walgreens, and Gilead. Join the close-knit engineering team that designs & develops our industry leading patient engagement platform and work with us to measurably improve the state of healthcare globally.Platform Hypewords: React, Redux, TypeScript, Slate, Downshift, ...Frontend Engineer: https://healthprize.recruiterbox.com/jobs/fk0fiwk?source=Hac..."
"THORN | REMOTE (US based) | Data Engineer | Data Scientist | Frontend Engineer with Design Experience | Software engineer - React/Node/AWS | FULL-TIME | $100k - $150k + Amazing benefits | https://www.thorn.orgThorn is a non-profit that builds technology to defend children from sexual abuse. Thorn gives you the opportunity to apply your expertise and passion to directly impact the lives of vulnerable and abused children. Our engineers and data scientists solve dynamic, quickly evolving problems with our network of partners from tech companies, NGOs, and law enforcement agencies. If you are able to bring clarity to complexity and lightness to heavy problems, you could be a great fit for our team.We are hiring for:- Data Engineer:  Apply today! https://grnh.se/d96da8052- Data Scientist: Apply today! https://grnh.se/0a426e162- Frontend Engineer with Design Experience: Apply today! https://grnh.se/c9baa7dd2- Software Engineer - React/Node/AWS:  Apply today! https://grnh.se/35ead91b2Tech stack: - React / Redux / Typescript / Express / Node.js / GraphQL / Python / PostgreSQL / Elasticsearch / Spark / Kafka / Docker / Terraform / Kubernetes / AWS / Pandas / Scikit Learn / NLTK, Gensim / Tensorflow / JupyterFully funded healthcare + unlimited vacation + remote first culture + flexible working + 401(k) + wellness."
"SEEKING FREELANCERS/EMPLOYEES - NYC preferred, but remote quite conceivableHappyFunCorp (https://happyfuncorp.com) - We're currently seeking good Rails, Django, React, and mobile developers, as well as excellent technical project managers.We do web and app development for a panoply of clients ranging from Fortune 500 to brand-new startups: right now the distribution is roughly 50-50. We prefer people with a reasonable amount of experience under their belt, but there are always exceptions. And we pay well.If interested, email: jobs@happyfuncorp.com"
"Abine - The Online Privacy Company | REMOTE or BOSTON, MA | Paart Time or Full Time | Web application, mobile and Full Stack Developers | https://www.abine.com/We are a small company 100% focused on making better online privacy easy.We make two products. Blur is a password manager with support for creating alias email addresses, phone numbers, and credit card numbers. DeleteMe is a service for removing private information from public data broker sites.We're looking for strong web application and full-stack developers who are interested in making a difference in the fight for privacy. We are profitable, have been doing this for years, and have millions of users.Please contact us at jobs at getabine dotcom.  
No recruiters. Thanks!"
