"HoneyLove (YC S18) | Head of Engineering, Product Manager, Supply Chain Manager | REMOTE | $100k-$190k + equity
HoneyLove (honeylove.co, YC S18) is a VC-funded fashion startup. We launched our online store in July 2018, and have generated over $2MM in sales in our first 5 months. We have been profitable since our launch and were chosen by Techcrunch as one of the top 10 companies from our Demo Day (https://tcrn.ch/2BABQZb).To manage our fast growth, we are looking to add three senior members to our team:* Head of Engineering: https://bit.ly/2Rrewnm* Product Manager: https://bit.ly/2LLOExa* Supply Chain Manager: https://bit.ly/2RvcqmjLet's chat! I am Betsie Larkin, and you can reach me at talent@honeylove.co."
"If only you guys were able to offer a relocation stipend or on-site outside of DC.  Upending your life to move to an expensive city for, at most, a 12 month commitment? No bueno.I'm not generally a fan of remote work so really what I'd like to see change is along the lines of: housing assistance, relocation stipend, a path to non-term-limited employment, and/or positions on-site outside of DC.(and that whole drug testing thing, but one step at a time)"
"The Block Crypto, Inc. | Head of Frontend Engineering | REMOTE | $100k-$130k + SIZABLE equity. The Block (https://www.theblockcrypto.com) is a VC-funded news media organization focussed on the world of cryptocurrencies and blockchain. We launched our newsletter and website in August 2018, onsite traffic and newsletter subs have grown tremendously since then. Apply here: https://tblck.co/hofe Email me with any questions jake@theblockcrypto.com"
"Sourcegraph (https://sourcegraph.com) | Software Engineer | San Francisco, CA or REMOTESourcegraph is building a better, smarter foundation for software development. Our code search allows you to instantly search across all of your company's private code to find what you are looking for (definitions, examples, error messages, etc.), and our browser extensions give you IDE-like code intelligence (e.g. hover tooltips, go to definition, find references, and more) while you are looking at code in your browser, on Sourcegraph, or on your code host. Software developers at big/recognizable companies around the world already love and use our product on a daily basis.We are a small distributed team of mostly engineers who love to code. If you are passionate about making the world better through software, come join us!Stack: Go, TypeScript, GraphQL, Docker + KubernetesOur code is open source: https://github.com/sourcegraph/sourcegraph Product roadmap: https://docs.sourcegraph.com/dev/roadmap Master plan: https://sourcegraph.com/plan Jobs page: https://github.com/sourcegraph/careers/"
"Neos Insurance | Developers, designers, project/product managers | Full Time | Brighton, UK | London, UK | Remote (UK ±1 hour) | https://neos.co.uk | https://neos.workable.comNeos are combining smart home devices and home insurance to make people's homes safer, and reduce the number of claims being paid out. We closed funding from Aviva, one the UK's largest insurers, late last year and we're now looking to grow the team. We sell our own insurance policies, and also provide a white labelled version of our IoT platform to insurers around the world.Specifically we're looking for mid-level/senior developers on both frontend and backend, project managers, product managers, designers, and QA engineers. For most of those roles we can hire people working in London, Brighton, or remote if you can demonstrate previous experience of doing so effectively.Our tech stack consists of lots of Ruby (and a little bit of Elixir) on the backend, Angular SPAs on the frontend, mobile apps for iOS and Android, alongside hardware from a variety of suppliers which we integrate with our platform.You can see the full job specs at https://neos.workable.com, but if you have any questions feel free to drop me an email on jon.wood@neos.co.uk and I'll either answer or find the right person to do so."
"Chesapeake Technology International | Junior and Lead Software Engineers | MD, VA, CA, CO | REMOTE, Onsite http://www.ctic-inc.comChesapeake Technology a 50 person DoD R&D company supporting remote work with locations in Denver, MD, VA, and CA is looking for software engineers with interest in SDR’s, networking, and visualization. We’re primarily a JVM/Java shop integrating sensors and equipment into a 3D GIS tool for RF modeling and analysis. We’re pushing hard for government open source! I’ve worked everything from CRDT’s to OpenGL shaders to even sewing sensors into a vest. Lots of opportunities to learn including graduate education to self-directed training. We're looking for people that are passionate about RF and GIS and want to work in small teams. Schedules are flexible and we rely on tools to work asynchronously. We won't whiteboard you.
Check out the open sites below and apply closest to you: https://ctic.hua.hrsmart.com/hr/ats/JobSearch/viewAll"
"Springshare | Intermediate/Senior Full Stack Software Engineer | Remote / NY / FL | Full TimeWe're a well established (since 2007) SaaS provider to libraries (academic/public/special) and education (colleges/k-12) - https://springshare.com. On our small team your work will have a measurable impact and the code you write will be deployed to production regularly, w/ millions of daily users.Requirements: 5+ years professional experience with PHP or Angular (or both). Experience in OOP/MVC concepts. AWS DevOps experience a plus.We offer: Remote workplace. Competitive salary & benefits. A small team environment. That great feeling that your work matters because it is improving the worlds’ libraries and schools.You must be highly productive working remotely. We’d prefer if you live in one of these states - NY, CA, FL, PA, MA, or KY. If you’re international the working hours must overlap significantly with US working hours. Send resume to jobs@springshare.com or contact me personally (I’m the founder/owner) at slaven@"
"ReifyHealth | Full-time Software Engineer, Engineering Manager | Boston | ONSITE, REMOTE (U.S.) | $100-150K + equityHi. We are building clinical trial software that makes a difference in people's lives. Clinical trials are slow, unpredictable and expensive and we aim to improve this for everyone's benefit. We have multiple apps in production and have plenty of interesting features coming up. We care about building meaningful products, providing delightful user experiences and actively listening to our users with the goal of continuous improvement. We actively use, contribute to and author open source libraries. We care about having a good remote culture and bring remoters in quarterly.We are hiring for three positions (full stack engineers feel free to apply to Frontend and Backend positions):* Engineering Manager ($100-160K): https://jobs.lever.co/reifyhealth/a9f1ad89-11f3-43aa-b94a-bc...* Junior to Senior Frontend Engineer: HTML, CSS, ReactJS, ClojureScript - https://jobs.lever.co/reifyhealth/089e5e4c-13e9-49c8-93a9-11...* Junior to Senior Backend Engineer: ClojureScript, Clojure, PostgreSQL - https://jobs.lever.co/reifyhealth/dd9f818f-d94c-4a0c-b97c-06...We value diversity and believe the unique contributions each of us brings drives our success. If this sounds exciting, we'd love to hear from you!"
"Citrusbyte | Front End Engineer | Back End Engineer | Software Architect | Designer | Full - Time, Remote + BenefitsCitrusbyte is a team of experts steeped in the theory and practice of mathematics and computer science. This is the the core of our iterative, hypothesis-driven process. We are craftspeople who build amazing products for some of the largest global household names. We believe in cultivating a high degree of leadership and technical excellence in all of our team members. Together we build applications that solve our customers' business-critical problems.While we have offices in LA and New York, we work remotely with team members around the world.Experienced Front End Engineer: https://bit.ly/2BcsXl2
Experienced Back End Engineer Java/React : https://bit.ly/2UzEDqJ
Solutions Architect: https://bit.ly/2EdRfhI
Product Designer: https://bit.ly/2QJI7IlTo view all of our roles, please visit: https://citrusbyte.applytojob.com/applyI would love to answer any questions. Please email kristen 
 dot williams at citrusbyte dot com"
"Radiant Earth Foundation | DevOps Engineer | Oakland, CA | OnsiteRadiant Earth Foundation's core mission is to make insights from remote sensing data and machine learning an order of magnitude more accessible for global non-profits, humanitarian organizations, emerging economy governments, and others. https://radiant.earthWe provide a free platform that takes care of all of the geospatial processing and machine learning so that users with any level of remote sensing experience, from zero to expert, can use near real-time data to get geospatial insights for their use case.In addition to our platform, we work with organizations on complex use cases with high-impact outcomes. Since our founding in 2016, we've worked with the Bill and Melinda Gates Foundation (a primary funder), the Omidyar Network (another primary funder), as well as the United Nations Institute for Training and Research, Schmidt Futures, the World Bank and more.We work with a range of fellows and contractors to support our efforts, but our in-house engineering/ML team is just 2 people :) In addition to being somebody who is excited to be part of a small team working on large-scale problems (right now we're all generalists, to an extent), we're especially interested in applicants who want to help us foster a team culture of respect, inclusion, and diversity.Apply here: https://bit.ly/2CLLzdKIf you have any questions, please don't hesitate to shoot me an email: alando (at) radiant.earth"
"ClubCollect | Backend Software Engineer | Amsterdam | REMOTEHelp us build an awesome billing engine! ClubCollect is looking for an experienced backend software engineer.We've created a service for (sports) clubs and other organizations to make invoicing of club members a breeze. Invoicing, reminding, online payments: everything is processed via ClubCollect. Our customers (mainly treasurers of sports clubs) absolutely love our product. Hundreds of thousands of club members have already made payments using our service.We're a small team (just under 50 people including 15 programmers), we love remote working but we also like to get together for beers and a great dinner.ClubCollect is built in Ruby (+ Ruby on Rails) and Elixir (+Phoenix). For this position you'll mainly develop in Ruby, with a chance to learn Elixir. We value simplicity, creative solutions, and the ability to get things done.You will have the opportunity to contribute to all areas of our code base.Requirements:- You love Ruby- Several years experience with a modern web framework such as Rails or Django- Not shy to touch JS@recruiters: please don't contact us, we're not interested.Apply at https://nlcollect-bv.workable.com/j/7D9B3037ED"
"TalkJS (https://talkjs.com) | Eindhoven (the Netherlands) | REMOTE (Europe/Africa only)TalkJS is the chat platform for platforms. We help online marketplaces and communities build great user-to-user communication. Working at TalkJS is fun because you get to make software that is used by other software engineers and that significantly impacts the experience of the users of our customers. Currently we're looking for a:SENIOR FULL-STACK DEVELOPEROur product is directly used by other developers, so there's deep API design work involved. We want to be faster at shipping new features and making existing features better, which is where you come in. Additionally, we're facing some big scaling challenges. Because of all this, we're looking for an experienced programmer who wants to help get TalkJS to the next level. Our stack consists of Elixir, PostgreSQL, React and TypeScript, but it's acceptable if you don't know all of these as long as you know many others.ABOUT YOUWe expect you to be fluent in at least 2 programming languages, and to have demonstrably deep experience with either Single-Page Web Applications, or relational databases, and at least some experience in both.Our team is small and highly proactive, and we expect the same from you. If you need to be told what to do all the time, don't apply. If you want to be the smartest person in a (chat) room full of interns, don't apply. If you want to move fast with an experienced team, get in touch.Apply by sending an email to hey@talkjs.com. (no recruiters or agencies please)"
"Commure, Inc. | San Francisco, CA / Boston, MA | Rust Engineer | Fulltime | ONSITEWe are a stealth startup working to fix the software doctors use. If you have seen what physicians have to put up with, it's a bad version of the 90s, and makes medical care worse and more expensive for everyone. We are a group of previously successful engineers and entrepreneurs (MIT, Dartmouth, Stripe, Twitter, Salesforce, DataPower, etc) and senior doctors (Johns Hopkins, UCSF, etc) who are determined to finally fix this.Compensation: market salary & equity -- we are well funded by top-tier VCs.Stack: includes Rust, React and Kubernetes. In addition to building our back end in Rust, we are also solving some very interesting problems in the areas of data processing, high-speed APIs, flexible UX frameworks and fine-grained privacy for healthcare data.Please email jobs@commure.com and mention ""[hnrust]"" in the subject line.
Other positions available:
- Senior Front End Engineer (React Native, React)
- Senior Security Engineer (identity, SAML, OAuth, etc)
(please use [hnfe] or [hnse] in subject line for the above).Locations: San Francisco, Boston or Montreal; sorry, no distributed/remote option at the moment."
"NodeBB Inc. | Toronto, Canada | Javascript Developer OR System Administrator OR UX Designer | Part Time, Pref. onsite, remote OKNodeBB Inc. is a small (under 10 employees) company that develops NodeBB, the open-source forum software powering many communities online today. We took a proven communication model (bulletin boards) and modernized it for today's audience.We're looking for either a developer or a system administrator, or a designer, with skill crossovers especially useful (isn't it always...), but definitely not a requirement.Developer - proficiency in javascript, web technologies, send portfolio and/or GH profile.Designer - Adobe XD, familiarity with things like inVision, wireframing concepts, would work closely with PMs. Send portfolio please.System admin - Familiarity with BASH, cloud computing, would work towards implementing best-practices company-wide and administering/hardening our fleet of cloud servers.To apply: julian+hiring [at] nodebb.org"
"Digital Onboarding | Senior Full-stack Engineer | REMOTE (US based) | Full timeDigital Onboarding is a marketing automation platform that helps banks and credit unions modernize their onboarding process and develop mutually beneficial, profitable relationships with their customers and members.Current stack: Elixir + Phoenix, React + Redux, Lambda (Node), PostgresRequirements: * 5+ years in front end and back end web development* Committed to building features you're proud of* Strong understanding of SQL databases* Strong understanding of functional programming* Strong communication skills Nice-to-haves:* Prior Elixir experience* Machine learning experience* Experience working on a remote-first, distributed team * Love of nachosSend me an email me at jonathan at digitalonboarding dot com."
"Rollbar | https://rollbar.com | San Francisco, Barcelona, REMOTE | Backend Engineer, Devops Engineer, Lead Product Designer, Technical PM, Demand Gen MarketerAbout Rollbar:* We help tens of thousands of developers find and fix errors faster.* Our backend handles billions of errors with low latency and high reliability* Our front-end allows developers to discover and drill down across millions of errors in real-time* Our open source libraries are used by some of the best engineering teams in the world, including Kayak, Twilio, Heroku, Zendesk, Instacart and Twitch* We're a ~30-person team (SF, Barcelona, and remote) on a mission to help companies build better software faster* Benefits and perks: competitive salary and stock options, medical, dental and vision insurance, 401k, annual conference budget, generous hardware and software allowance, casual work environment, inclusive team-oriented culture, rapid career growth opportunities, have fun and have an impact.We're currently hiring for:- Engineering (backend, ops)- Lead Product Designer- Technical Product Manager- Marketing: demand gen, marketing ops, product marketingTo get in touch, please apply via https://rollbar.com/jobs"
"New Vector (Matrix.org & Riot.im) | London, UK, Rennes, Fr | ONSITE/REMOTE | Full-time | Team of 20 growing rapidlyNew Vector backs the Matrix.org and Riot.im projects for open secure decentralised communication. Our mission is to create a universal open network and protocol for real-time communication. Recently the French government announced that they will build their messaging infrastructure on Matrix technology (https://news.ycombinator.com/item?id=16933736)Our flagship client Riot.im has grown exponentially since launch in 2016. Our (lofty) aim is to disrupt incumbent centralized services like Slack, WhatsApp and Discord by bringing to bear the unique open ecosystem of Matrix.orgIf you would like to know more, either write to us at jobs@riot.im or reach out to me via Riot.im on @neilj:matrix.orgFull specs live hereSenior Operations Engineer - https://new-vector.workable.com/j/E87A97E42DSupport Engineer  - https://new-vector.workable.com/j/980C4B0EAFA bit about our culture and values lives here - https://vector.im/Even if you are not a perfect match for the above get in touch anyway, we’re always keen to talk to people interested in Matrix."
"Thanx | SF, DEN, Remote | Principal Engineer | ONSITE/REMOTE, Full-time | $160-$200K | https://boards.greenhouse.io/thanx/jobs/903207Americans spend more than $5 trillion on restaurants, retail, and services each year. Nearly 90% of those transactions happen in a real-world store. Data is king and online it powers personalized customer experiences and product recommendations. Offline, however, it’s still 1999. Brands are blind to their customers, causing them to spend more and more money on “megaphone” marketing. No wonder brick-and-mortar stores are being left behind.Thanx is fundamentally changing that. Thanx personalizes every interaction between a merchant and their best customers, resulting in measurable increases in revenue for merchants and far greater personalization for consumers. How?
•	Through proprietary partnerships with credit card networks (e.g. Visa, Mastercard, Amex), Thanx can reward consumers for their purchases and deliver highly-customized promotions
•	Through our interactive dashboard, Thanx makes even the smallest marketing team a data-science driven expert in personalization - right message to the right customer at the right time through the right channel.
•	By measuring our success based on revenue generated (not opens and clicks of emails)Think of us as Salesforce meets Google Adwords for offline retail. Thanx is backed by some of the best investors in the world — Sequoia Capital, Icon Ventures, and Andy Rachleff (CEO Wealthfront, cofounder Benchmark Capital).Thanx Engineering
•	Team: early engineers at AWS, Cloudera, Climate, Zenefits, Okta. Experience from successful product companies like Disney, Google, and Facebook. This is an elite engineering team, period.
•	Growth: 10x YOY data growth; $100M+ delivered to merchants; 200% team growth; modern, rapidly-evolving platform -- adopted Golang, Elasticsearch, NLP, React, React Native, GraphQL, and added 5+ new microservices; all in the last 12 months. And we are just getting started.
•	Culture: data-driven decision-making, risk-taking, no hierarchy, collaboration & shared responsibility, testing and continuous improvement. As a remote-friendly team, we have flexible work hours and PTO policy. We work and play hard -- be warned, when it comes to Mario Kart, we are super competitive!"
"Zapier | BE/Python Engineer, FE/React Engineer, Test Automation Engineer, Engineering Manager, Engineering Director (soon) | Earth | 100% REMOTE | https://zapier.com/jobs/Zapier is 100% remote from YC S12. We're just over 7 years old, wrapped 2018 with 200 folks across 20+ countries -- about 75 of those are engineers! We're sustainably profitable and have a lot of cool stuff we want to do in 2019 to bring automation to the masses.If you haven't heard of Zapier, we're sort of like Legos for the internet -- we help people build workflows around SaaS software or other online productivity tools. We're doing well, but we have a lot of work to do still. I think 2019 might be Zapier's most exciting year to date! :-)We're also doing a lot of technical investment in 2019 around simplifying and scaling the product, evolving the architectural design, and of course a bit of tech debt reduction (which is mostly deleting code without breaking anything!).We're also going to be hiring a Director/Manager-of-Managers layer as well as some Security Engineers in early 2019, but the job posts aren't up yet. If you are interested in those, maybe drop me a line bryan@zapier.com?https://zapier.com/jobs/4142032002/front-end-engineer/https://zapier.com/jobs/4146672002/back-end-engineer/https://zapier.com/jobs/4138904002/test-automation-engineer/https://zapier.com/jobs/4142031002/engineering-manager/"
Are all of the engineering roles open to remote workers? I'm interested in the Backend Manager position and located in D.C.
"Lookback | Mobile developers | Remote | FulltimeHelping the world build great experiences.Lookback is a cash flow positive, remote-first, SaaS startup from Stockholm, with headquarters in Palo Alto.Android Developer: https://lookback.io/jobs/android-developer-2019/iOS Developer: https://lookback.io/jobs/ios-developer-2019/About: https://lookback.io/about/"
Is this open to remote?
"Pex | Multiple positions | Downtown, Los Angeles | US-ONLY REMOTE or ONSITE, FULL-TIME | $105,000 Minimum Salary + Equity | https://angel.co/pexeso/jobsPex is an audio-visual reverse search engine, that uses the content as a base for its search (think of Google Image Search). We operate at a pretty large scale with some fun stack (https://softwareengineeringdaily.com/2018/06/22/video-search...).We're looking for senior engineers for positions listed bellow:  - front-end (React and Redux)  
  - signal processing (mostly R&D)  
  - DBA architect (Postgres [with Citus], FoundationDB, others)  
  - Go and Java for work on our backend systems  
  - C/C++, Rust to help us optimize our algorithms

Remote is only available for US based candidates. For all employees, we offer:  - equal salary within US (no matter where you live you are paid as in LA)
  - 30 days of paid vacation
  - fully covered health benefits (gold/platinum) [70% coverage for your family]
  - 3 months paid parental leave
  - $300 monthly allowance for co-working or commuting
  - covering all costs of visiting conferences

If you want to learn more, reach out directly to me at r@pex.com"
"Highrise (YC S18) - Senior Android Developer | REMOTE | Full-time | jobs@high.rs | Virtual worldHighrise is the leading virtual world on iOS. We're backed by YC, Maveron, Bessemer and other leading investors. Every day, over 100,000 people use our application to make friends, keep in touch, decorate avatars and rooms, and chat.As Senior Android Developer, you'll work closely with our CTO and Head of Mobile to lead Highrise on Android. Our CTO built Highrise (https://itunes.apple.com/us/app/highrise-virtual-world/id924...) from the ground up, and our Head of Mobile was VP Eng at Ticketmaster Mobile, where he built dozens of mobile apps. You'll work with them to develop a unique 3-layered mobile infrastructure - C++ business logic layer, Cocos2dX game engine layer, and native (Java/Kotlin) UI layer. The objective is to combine gaming and social tech to build a new kind of social platform on mobile.To apply, email jobs@high.rs."
"Sematell | Clojure Developer | Saarbrücken, partially REMOTE, Germany |Sematell is Europe's leading provider of call-center Response Management software. We do e-mails, social media postings even fax & letters and help our customers help their customers to the best answer as quickly as possible. 
We use AI, rule engines, scheduling engines, steam engines.We are looking for an experienced Clojure developer who would help us shape the next generation of our platform, starting from scratch, going full SaaS and world-wide.Reqs: Proven Clojure experience. The ideal candidate has some background in Java Enterprise Software and is aware of the challenges in shifting mind-sets to functional, cloud-first systems.Get in touch at jochen dot bedersdorfer at sematell dot com."
